{
	"addonId": "My Calculator",
	"displayName": "Calculator",
	"URL": "https://github.com/AndhiMardianto/MyCalculator/releases/download/v1.0.0/MyCalculator-1.0.0.nvda-addon",
	"description": "This is a calculator for NVDA addon with better user experience ",
	"sha256": "9a12b0968891955afc3a005a9b9d33a3abcbf6595a0a6ac51963b566d31da76e",
	"addonVersionName": "1.0.0",
	"addonVersionNumber": {
		"major": 1,
		"minor": 0,
		"patch": 0
	},
	"minNVDAVersion": {
		"major": 2023,
		"minor": 3,
		"patch": 0
	},
	"lastTestedVersion": {
		"major": 2024,
		"minor": 4,
		"patch": 1
	},
	"channel": "stable",
	"publisher": "Andhi Mardianto",
	"sourceURL": "https://github.com/AndhiMardianto/MyCalculator",
	"license": "GPL v2",
	"homepage": "https://github.com/AndhiMardianto/MyCalculator",
	"licenseURL": "https://www.gnu.org/licenses/gpl-2.0.html",
	"submissionTime": 1734718465000,
	"translations": []
}