{
  "addonId": "quickNotetaker",
  "displayName": "Quick Notetaker",
  "URL": "https://github.com/mohammad-suliman/quickNotetaker/releases/download/v1.2/quickNotetaker-1.2.nvda-addon",
  "description": "A note taker for NVDA. Allows the user to create, edit, view, manage and export notes to different formats.",
  "sha256": "750c8bf59883a67eebbf2988e2c31357512581c40ef810c55a194702ef2da406",
  "addonVersionName": "1.2",
  "addonVersionNumber": {
    "major": 1,
    "minor": 2,
    "patch": 0
  },
  "minNVDAVersion": {
    "major": 2019,
    "minor": 3,
    "patch": 0
  },
  "lastTestedVersion": {
    "major": 2023,
    "minor": 1,
    "patch": 0
  },
  "channel": "stable",
  "publisher": "Mohammad Suliman & Eilana Benish",
  "sourceURL": "https://github.com/mohammad-suliman/quickNotetaker",
  "license": "GPL v2",
  "licenseURL": "https://www.gnu.org/licenses/gpl-2.0.html",
  "translations": [
    {
      "language": "ar",
      "displayName": "Quick Notetaker",
      "description": "\u0645\u062f\u0648\u0646 \u0645\u0644\u0627\u062d\u0638\u0627\u062a \u0644 NVDA. \u064a\u0645\u0643\u0646 \u0627\u0644\u0645\u0633\u062a\u062e\u062f\u0645 \u0645\u0646 \u0625\u0646\u0634\u0627\u0621\u060c \u062a\u062d\u0631\u064a\u0631\u060c \u0639\u0631\u0636\u060c \u0625\u062f\u0627\u0631\u0629 \u0648\u062a\u0635\u062f\u064a\u0631 \u0627\u0644\u0645\u0644\u0627\u062d\u0638\u0627\u062a \u0627\u0644\u0649 \u0635\u064a\u063a \u0645\u062e\u062a\u0644\u0641\u0629."
    },
    {
      "language": "de",
      "displayName": "Quick Notetaker",
      "description": "Ein Notizbuch f\u00fcr NVDA. Erm\u00f6glicht dem Benutzer das Erstellen, Bearbeiten, Anzeigen, Verwalten und Exportieren von Notizen."
    },
    {
      "language": "he",
      "displayName": "Quick Notetaker",
      "description": "\u05e2\u05d5\u05e8\u05da \u05d4\u05e4\u05ea\u05e7\u05d9\u05dd \u05dc NVDA. \u05de\u05d0\u05e4\u05e9\u05e8 \u05d9\u05e6\u05d9\u05e8\u05d4, \u05e2\u05e8\u05d9\u05db\u05d4, \u05e6\u05e4\u05d9\u05d9\u05d4, \u05e0\u05d9\u05d4\u05d5\u05dc \u05d5\u05d9\u05e6\u05d5\u05d0 \u05d4\u05d4\u05e2\u05e8\u05d5\u05ea \u05dc\u05e4\u05d5\u05e8\u05de\u05d8\u05d9\u05dd \u05e9\u05d5\u05e0\u05d9\u05dd."
    },
    {
      "language": "ru",
      "displayName": "\u0411\u044b\u0441\u0442\u0440\u044b\u0439 \u0431\u043b\u043e\u043a\u043d\u043e\u0442",
      "description": "\u0411\u043b\u043e\u043a\u043d\u043e\u0442 \u0434\u043b\u044f NVDA. \u041f\u043e\u0437\u0432\u043e\u043b\u044f\u0435\u0442 \u043f\u043e\u043b\u044c\u0437\u043e\u0432\u0430\u0442\u0435\u043b\u044e \u0441\u043e\u0437\u0434\u0430\u0432\u0430\u0442\u044c, \u0440\u0435\u0434\u0430\u043a\u0442\u0438\u0440\u043e\u0432\u0430\u0442\u044c, \u043f\u0440\u043e\u0441\u043c\u0430\u0442\u0440\u0438\u0432\u0430\u0442\u044c, \u0443\u043f\u0440\u0430\u0432\u043b\u044f\u0442\u044c \u0438 \u044d\u043a\u0441\u043f\u043e\u0440\u0442\u0438\u0440\u043e\u0432\u0430\u0442\u044c \u0437\u0430\u043c\u0435\u0442\u043a\u0438 \u0432 \u0440\u0430\u0437\u043b\u0438\u0447\u043d\u044b\u0435 \u0444\u043e\u0440\u043c\u0430\u0442\u044b."
    },
    {
      "language": "zh_CN",
      "displayName": "\u5feb\u6377\u7b14\u8bb0",
      "description": "\u7528\u4e8e NVDA \u7684\u5feb\u6377\u7b14\u8bb0\u63d2\u4ef6\u3002\u8be5\u63d2\u4ef6\u53ef\u4ee5\u8ba9\u7528\u6237\u521b\u5efa\u3001\u7f16\u8f91\u3001\u67e5\u770b\u3001\u7ba1\u7406\u548c\u5bfc\u51fa\u4e0d\u540c\u683c\u5f0f\u7684\u7b14\u8bb0\u3002"
    }
  ],
  "vtScanUrl": "https://www.virustotal.com/gui/file/750c8bf59883a67eebbf2988e2c31357512581c40ef810c55a194702ef2da406"
}
