{
	"addonId": "voiceSwitcher",
	"displayName": "Voice Switcher",
	"URL": "https://github.com/smartthinh/voice-switcher/releases/download/26.2/voiceSwitcher_26.2.nvda-addon",
	"description": "An add-on that helps you switch back and forth between different voices in a synthesizer or multiple synthesizers.",
	"sha256": "c3cd22440c755c90018d18631734067257d8d88bb50a8083e1fc19c06cc2d7d3",
	"addonVersionName": "26.2",
	"addonVersionNumber": {
		"major": 26,
		"minor": 2,
		"patch": 0
	},
	"minNVDAVersion": {
		"major": 2024,
		"minor": 1,
		"patch": 0
	},
	"lastTestedVersion": {
		"major": 2026,
		"minor": 2,
		"patch": 0
	},
	"channel": "stable",
	"publisher": "Smart Thinh",
	"sourceURL": "https://github.com/smartthinh/voice-switcher",
	"license": "GPL v2",
	"homepage": "https://github.com/smartthinh/voice-switcher",
	"licenseURL": "https://www.gnu.org/licenses/gpl-2.0.html",
	"submissionTime": 1788446046000,
	"translations": []
}