{
	"addonId": "stationPlaylist",
	"displayName": "StationPlaylist",
	"URL": "https://github.com/ChrisDuffley/stationPlaylist/releases/download/23.05/stationPlaylist-23.05.nvda-addon",
	"description": "Enhances support for StationPlaylist apps. In addition, adds global commands for the Studio application from everywhere.",
	"sha256": "485f6908e7ec230084a19ef946829a568b859993aa165be704a48bdbe6c665d8",
	"addonVersionName": "23.05",
	"addonVersionNumber": {
		"major": 23,
		"minor": 5,
		"patch": 0
	},
	"minNVDAVersion": {
		"major": 2022,
		"minor": 4,
		"patch": 0
	},
	"lastTestedVersion": {
		"major": 2023,
		"minor": 1,
		"patch": 0
	},
	"channel": "stable",
	"publisher": "ChrisDuffley",
	"sourceURL": "https://github.com/ChrisDuffley/StationPlaylist",
	"license": "GPL v2",
	"homepage": "https://github.com/ChrisDuffley/stationPlaylist",
	"licenseURL": "https://www.gnu.org/licenses/gpl-2.0.html",
	"translations": [
		{
			"language": "ar",
			"displayName": "StationPlaylist",
			"description": "Enhances support for StationPlaylist apps. In addition, adds global commands for the Studio application from everywhere."
		},
		{
			"language": "bg",
			"displayName": "StationPlaylist",
			"description": "Enhances support for StationPlaylist apps. In addition, adds global commands for the Studio application from everywhere."
		},
		{
			"language": "de",
			"displayName": "StationPlaylist",
			"description": "Enhances support for StationPlaylist apps. In addition, adds global commands for the Studio application from everywhere."
		},
		{
			"language": "de_CH",
			"displayName": "StationPlaylist",
			"description": "Enhances support for StationPlaylist apps. In addition, adds global commands for the Studio application from everywhere."
		},
		{
			"language": "es",
			"displayName": "StationPlaylist",
			"description": "Enhances support for StationPlaylist apps. In addition, adds global commands for the Studio application from everywhere."
		},
		{
			"language": "es_CO",
			"displayName": "StationPlaylist",
			"description": "Enhances support for StationPlaylist apps. In addition, adds global commands for the Studio application from everywhere."
		},
		{
			"language": "fr",
			"displayName": "StationPlaylist",
			"description": "Enhances support for StationPlaylist apps. In addition, adds global commands for the Studio application from everywhere."
		},
		{
			"language": "gl",
			"displayName": "StationPlaylist",
			"description": "Enhances support for StationPlaylist apps. In addition, adds global commands for the Studio application from everywhere."
		},
		{
			"language": "he",
			"displayName": "StationPlaylist",
			"description": "Enhances support for StationPlaylist apps. In addition, adds global commands for the Studio application from everywhere."
		},
		{
			"language": "hr",
			"displayName": "StationPlaylist",
			"description": "Enhances support for StationPlaylist apps. In addition, adds global commands for the Studio application from everywhere."
		},
		{
			"language": "hu",
			"displayName": "StationPlaylist",
			"description": "Enhances support for StationPlaylist apps. In addition, adds global commands for the Studio application from everywhere."
		},
		{
			"language": "kn",
			"displayName": "StationPlaylist",
			"description": "Enhances support for StationPlaylist apps. In addition, adds global commands for the Studio application from everywhere."
		},
		{
			"language": "ne",
			"displayName": "StationPlaylist",
			"description": "Enhances support for StationPlaylist apps. In addition, adds global commands for the Studio application from everywhere."
		},
		{
			"language": "pl",
			"displayName": "StationPlaylist",
			"description": "Enhances support for StationPlaylist apps. In addition, adds global commands for the Studio application from everywhere."
		},
		{
			"language": "pt_BR",
			"displayName": "StationPlaylist",
			"description": "Enhances support for StationPlaylist apps. In addition, adds global commands for the Studio application from everywhere."
		},
		{
			"language": "pt_PT",
			"displayName": "StationPlaylist",
			"description": "Enhances support for StationPlaylist apps. In addition, adds global commands for the Studio application from everywhere."
		},
		{
			"language": "ro",
			"displayName": "StationPlaylist",
			"description": "Enhances support for StationPlaylist apps. In addition, adds global commands for the Studio application from everywhere."
		},
		{
			"language": "sk",
			"displayName": "Station Playlist",
			"description": "Enhances support for StationPlaylist apps. In addition, adds global commands for the Studio application from everywhere."
		},
		{
			"language": "sr",
			"displayName": "StationPlaylist",
			"description": "Enhances support for StationPlaylist apps. In addition, adds global commands for the Studio application from everywhere."
		},
		{
			"language": "tr",
			"displayName": "StationPlaylist",
			"description": "Enhances support for StationPlaylist apps. In addition, adds global commands for the Studio application from everywhere."
		},
		{
			"language": "vi",
			"displayName": "StationPlaylist",
			"description": "Enhances support for StationPlaylist apps. In addition, adds global commands for the Studio application from everywhere."
		}
	]
}
