{
	"addonId": "eclipseEnhance",
	"displayName": "Eclipse Enhance",
	"URL": "https://github.com/albzan/eclipse-nvda/releases/download/2024.1/eclipseEnhance-2024.1.nvda-addon",
	"description": "Enhance the speech and braille support while using the Eclipse IDE reportings errors and warnings.",
	"sha256": "9afc6e1b72b0d28bcef6993d7f6cf3cddf0ed89c755e6d199a9eceeabcba1979",
	"addonVersionName": "2024.1",
	"addonVersionNumber": {
		"major": 2024,
		"minor": 1,
		"patch": 0
	},
	"minNVDAVersion": {
		"major": 2021,
		"minor": 1,
		"patch": 0
	},
	"lastTestedVersion": {
		"major": 2024,
		"minor": 1,
		"patch": 0
	},
	"channel": "stable",
	"publisher": "albzan",
	"sourceURL": "https://github.com/albzan/eclipse-nvda",
	"license": "GPL v2",
	"licenseURL": "https://www.gnu.org/licenses/gpl-2.0.html",
	"translations": [
		{
			"language": "es",
			"displayName": "Eclipse Enhance",
			"description": "Mejora el soporte de habla y braille al usar el entorno de desarrollo  integrado Eclipse reportando errores y advertencias."
		}
	]
}