{
	"addonId": "Internet speed checker",
	"displayName": "Internet Speed Checker",
	"URL": "https://github.com/anhlocvu/Internet-speed-checker/releases/download/v1.0.0/Internet.speed.checker-1.0.0.nvda-addon",
	"description": "An add-on to check your internet speed (download, upload, ping) with NVDA.",
	"sha256": "22340c725b2da2e5e63b0fb88f4244ba49fd6ec528bedbfb5de7a446dd0c868a",
	"addonVersionName": "1.0.0",
	"addonVersionNumber": {
		"major": 1,
		"minor": 0,
		"patch": 0
	},
	"minNVDAVersion": {
		"major": 2024,
		"minor": 1,
		"patch": 0
	},
	"lastTestedVersion": {
		"major": 2025,
		"minor": 3,
		"patch": 3
	},
	"channel": "stable",
	"publisher": "lc boy",
	"sourceURL": "https://github.com/anhlocvu/Internet-speed-checker",
	"license": "GPL v2",
	"homepage": "https://github.com/anhlocvu/Internet-speed-checker",
	"changelog": "",
	"licenseURL": "https://www.gnu.org/licenses/gpl-2.0.html",
	"submissionTime": 1772517583000,
	"translations": []
}