{
	"addonId": "SessionTimer",
	"displayName": "Session Timer",
	"URL": "https://github.com/Accessibility-armenia/nvda-SessionTimer/releases/download/v0.0.4/SessionTimer-0.0.4.nvda-addon",
	"description": "Announces how long NVDA has been running since startup.",
	"sha256": "ef98498b8e65f1e5e6441760fbb8e8cbfb58c506c26a2a3bb3bee41cd56ac0e7",
	"addonVersionName": "0.0.4",
	"addonVersionNumber": {
		"major": 0,
		"minor": 0,
		"patch": 4
	},
	"minNVDAVersion": {
		"major": 2026,
		"minor": 1,
		"patch": 0
	},
	"lastTestedVersion": {
		"major": 2026,
		"minor": 3,
		"patch": 3
	},
	"channel": "stable",
	"publisher": "Tigran Navasardyan",
	"sourceURL": "https://github.com/Accessibility-armenia/nvda-SessionTimer",
	"license": "GPL v2",
	"homepage": "https://github.com/Accessibility-armenia/nvda-SessionTimer",
	"licenseURL": "https://www.gnu.org/licenses/gpl-2.0.html",
	"submissionTime": 1775108017000,
	"translations": []
}