{
  "addonId": "radioCenter",
  "displayName": "radioCenter",
  "URL": "https://github.com/DollaR84/radioCenter/releases/download/stable/radioCenter-1.5.2.nvda-addon",
  "description": "this addon allows you to play online radio stations",
  "sha256": "e915da26d7effbcbce1c924e96ed21a7309046c6d096bc82e2fcef859c527b19",
  "addonVersionName": "1.5.2",
  "addonVersionNumber": {
    "major": 1,
    "minor": 5,
    "patch": 2
  },
  "minNVDAVersion": {
    "major": 2021,
    "minor": 2,
    "patch": 0
  },
  "lastTestedVersion": {
    "major": 2024,
    "minor": 1,
    "patch": 0
  },
  "channel": "stable",
  "publisher": "Ruslan Dolovaniuk",
  "sourceURL": "https://github.com/DollaR84/radioCenter",
  "license": "GPL v2",
  "homepage": "https://github.com/DollaR84/radioCenter",
  "licenseURL": "https://www.gnu.org/licenses/gpl-2.0.html",
  "translations": [
    {
      "language": "cz",
      "displayName": "radioCenter",
      "description": "tento addon v\u00e1m umo\u017e\u0148uje poslouchat online rozhlasov\u00e9 stanice"
    },
    {
      "language": "en",
      "displayName": "radioCenter",
      "description": "this addon allows you to play online radio stations"
    },
    {
      "language": "ru",
      "displayName": "radioCenter",
      "description": "\u044d\u0442\u043e \u0434\u043e\u043f\u043e\u043b\u043d\u0435\u043d\u0438\u0435 \u043f\u043e\u0437\u0432\u043e\u043b\u044f\u0435\u0442 \u0432\u0430\u043c \u0441\u043b\u0443\u0448\u0430\u0442\u044c \u043e\u043d\u043b\u0430\u0439\u043d \u0440\u0430\u0434\u0438\u043e\u0441\u0442\u0430\u043d\u0446\u0438\u0438"
    },
    {
      "language": "tr",
      "displayName": "radyo merkezi",
      "description": "bu eklenti \u00e7evrimi\u00e7i radyo istasyonlar\u0131n\u0131 \u00e7alman\u0131za olanak tan\u0131r."
    },
    {
      "language": "uk",
      "displayName": "radioCenter",
      "description": "\u0446\u0435 \u0434\u043e\u043f\u043e\u0432\u043d\u0435\u043d\u043d\u044f \u0434\u043e\u0437\u0432\u043e\u043b\u044f\u0454 \u0432\u0430\u043c \u0441\u043b\u0443\u0445\u0430\u0442\u0438 \u043e\u043d\u043b\u0430\u0439\u043d \u0440\u0430\u0434\u0456\u043e\u0441\u0442\u0430\u043d\u0446\u0456\u0457"
    }
  ],
  "reviewUrl": "https://github.com/nvaccess/addon-datastore/discussions/3763"
}
