{
	"addonId": "terminalAccess",
	"displayName": "Terminal Access for NVDA",
	"URL": "https://github.com/PratikP1/Terminal-Access-for-NVDA/releases/download/v1.0.45/terminalAccess-1.0.45.nvda-addon",
	"description": "Provides enhanced terminal accessibility for Windows Terminal and PowerShell, enabling screen reader users to efficiently navigate and interact with command-line interfaces. Inspired by TDSR (Terminal Data Structure Reader) and incorporates functionality from both TDSR and Speakup. Advanced features inspired by community suggestions and discussions.",
	"sha256": "0f4e154e7d76066a9e07d51f8c4b2c783deb6e500b0e51100e2e5cb929585dbc",
	"addonVersionName": "1.0.45",
	"addonVersionNumber": {
		"major": 1,
		"minor": 0,
		"patch": 45
	},
	"minNVDAVersion": {
		"major": 2025,
		"minor": 1,
		"patch": 0
	},
	"lastTestedVersion": {
		"major": 2026,
		"minor": 1,
		"patch": 0
	},
	"channel": "stable",
	"publisher": "Pratik Patel",
	"sourceURL": "https://github.com/PratikP1/Terminal-Access-for-NVDA",
	"license": "GPL v3",
	"homepage": "https://github.com/PratikP1/Terminal-Access-for-NVDA",
	"licenseURL": "https://www.gnu.org/licenses/gpl-3.0.html",
	"submissionTime": 1771861058000,
	"translations": []
}