{
	"addonId": "InternetUsageMonitor",
	"displayName": "InternetUsageMonitor",
	"URL": "https://github.com/rayo-alcantar/InternetUsageMonitor/releases/download/2.1.1/InternetUsageMonitor-2.1.1.nvda-addon",
	"description": "Complemento para NVDA que monitorea el uso de internet.",
	"sha256": "5dd4b730565001b2f44efaf0857868e5c053a855813ddc375d10315e0bb831a8",
	"addonVersionName": "2.1.1",
	"addonVersionNumber": {
		"major": 2,
		"minor": 1,
		"patch": 1
	},
	"minNVDAVersion": {
		"major": 2024,
		"minor": 1,
		"patch": 0
	},
	"lastTestedVersion": {
		"major": 2024,
		"minor": 1,
		"patch": 0
	},
	"channel": "stable",
	"publisher": "Angel Alc\u00e1ntar",
	"sourceURL": "https://github.com/rayo-alcantar/InternetUsageMonitor",
	"license": "GPL v2",
	"homepage": "https://github.com/rayo-alcantar/InternetUsageMonitor/",
	"licenseURL": "https://www.gnu.org/licenses/gpl-2.0.html",
	"translations": [
		{
			"language": "en",
			"displayName": "InternetUsageMonitor",
			"description": "This addon for NVDA allows you to monitor internet usage."
		},
		{
			"language": "ru",
			"displayName": "\u0418\u043d\u0442\u0435\u0440\u043d\u0435\u0442-\u043c\u043e\u043d\u0438\u0442\u043e\u0440",
			"description": "\u042d\u0442\u043e \u0434\u043e\u043f\u043e\u043b\u043d\u0435\u043d\u0438\u0435 \u043f\u043e\u0437\u0432\u043e\u043b\u044f\u0435\u0442 \u043e\u0442\u0441\u043b\u0435\u0436\u0438\u0432\u0430\u0442\u044c \u0438\u0441\u043f\u043e\u043b\u044c\u0437\u043e\u0432\u0430\u043d\u0438\u0435 \u0418\u043d\u0442\u0435\u0440\u043d\u0435\u0442\u0430."
		},
		{
			"language": "uk",
			"displayName": "InternetUsageMonitor",
			"description": "\u0414\u043e\u0434\u0430\u0442\u043e\u043a \u0434\u043b\u044f NVDA, \u044f\u043a\u0438\u0439 \u0432\u0456\u0434\u0441\u0442\u0435\u0436\u0443\u0454 \u0432\u0438\u043a\u043e\u0440\u0438\u0441\u0442\u0430\u043d\u043d\u044f \u0406\u043d\u0442\u0435\u0440\u043d\u0435\u0442\u0443."
		}
	]
}