{
	"addonId": "tiflotecniaVoices",
	"displayName": "Tiflotecnia voices for NVDA",
	"URL": "https://github.com/ruifontes/tiflotecniaVoices/releases/download/4.1.1/tiflotecniaVoices-4.1.1.nvda-addon",
	"description": "Tiflotecnia voices for NVDA\nNVDA driver to the Cerence Embedded TTS synth\nLicense required to use the voices.",
	"sha256": "fd0a68c69ecc2d440d4caf8a5f1015dcef62bbe3f0d42fb0fb473ad61dfdd4aa",
	"addonVersionName": "4.1.1",
	"addonVersionNumber": {
		"major": 4,
		"minor": 1,
		"patch": 1
	},
	"minNVDAVersion": {
		"major": 2023,
		"minor": 1,
		"patch": 0
	},
	"lastTestedVersion": {
		"major": 2025,
		"minor": 1,
		"patch": 0
	},
	"channel": "stable",
	"publisher": "ruifontes",
	"sourceURL": "https://github.com/ruifontes/tiflotecniaVoices",
	"license": "GPL v2",
	"homepage": "https://www.tiflotecnia.com",
	"licenseURL": "https://www.gnu.org/licenses/gpl-2.0.html",
	"submissionTime": 1749925143000,
	"translations": [
		{
			"language": "de",
			"displayName": "Tiflotecnia-Stimmen für NVDA",
			"description": "Tiflotecnia voices for NVDA\nNVDA driver to the Cerence Embedded TTS synth\nLicense required to use the voices."
		},
		{
			"language": "es",
			"displayName": "Voces de tiflotecnia para NVDA",
			"description": "Tiflotecnia voices for NVDA\nNVDA driver to the Cerence Embedded TTS synth\nLicense required to use the voices."
		},
		{
			"language": "he",
			"displayName": "קולות Tiflotecnia עבור NVDA",
			"description": "Tiflotecnia voices for NVDA\nNVDA driver to the Cerence Embedded TTS synth\nLicense required to use the voices."
		},
		{
			"language": "hr",
			"displayName": "Tiflotecnia voices for NVDA",
			"description": "Tiflotecnia voices for NVDA\nNVDA driver to the Cerence Embedded TTS synth\nLicense required to use the voices."
		},
		{
			"language": "it",
			"displayName": "Voci di Tiflotecnia per NVDA",
			"description": "Tiflotecnia voices for NVDA\nNVDA driver to the Cerence Embedded TTS synth\nLicense required to use the voices."
		},
		{
			"language": "ja",
			"displayName": "Tiflotecnia voices for NVDA",
			"description": "Tiflotecnia voices for NVDA\nNVDA driver to the Cerence Embedded TTS synth\nLicense required to use the voices."
		},
		{
			"language": "pl",
			"displayName": "Głosy Tiflotecnia dla NVDA",
			"description": "Tiflotecnia voices for NVDA\nNVDA driver to the Cerence Embedded TTS synth\nLicense required to use the voices."
		},
		{
			"language": "pt",
			"displayName": "Vozes Tiflotecnia para o NVDA",
			"description": "Tiflotecnia voices for NVDA\nNVDA driver to the Cerence Embedded TTS synth\nLicense required to use the voices."
		},
		{
			"language": "ru",
			"displayName": "Голоса Tiflotecnia для NVDA",
			"description": "Tiflotecnia voices for NVDA\nNVDA driver to the Cerence Embedded TTS synth\nLicense required to use the voices."
		},
		{
			"language": "tr",
			"displayName": "NVDA için Tiflotecnia sesleri",
			"description": "Tiflotecnia voices for NVDA\nNVDA driver to the Cerence Embedded TTS synth\nLicense required to use the voices."
		},
		{
			"language": "zh_CN",
			"displayName": "NVDA 的 Tiflotecnia 语音",
			"description": "Tiflotecnia voices for NVDA\nNVDA driver to the Cerence Embedded TTS synth\nLicense required to use the voices."
		}
	],
	"reviewUrl": "https://github.com/nvaccess/addon-datastore/discussions/5322",
	"vtScanUrl": "https://www.virustotal.com/gui/file/fd0a68c69ecc2d440d4caf8a5f1015dcef62bbe3f0d42fb0fb473ad61dfdd4aa"
}
