{
	"addonId": "freeradio",
	"displayName": "freeRadio",
	"URL": "https://github.com/Surveyor123/freeradio/releases/download/v2026.20.6/freeradio-2026.20.6.nvda-addon",
	"description": "FreeRadio is an internet radio add-on for NVDA that provides seamless access to thousands of stations via the Radio Browser open directory. It features a fully accessible station browser with search, country filter, favourites management, and per-station audio profiles. Playback is handled by a prioritised backend chain (BASS, VLC, PotPlayer, Windows Media Player) with support for volume control, audio effects, output device selection, and simultaneous audio mirroring to a second device. Additional features include instant and scheduled recording, sleep and alarm timers, automatic ICY metadata announcements, Shazam-based music recognition, and a liked-songs log. All controls and shortcuts are designed for NVDA accessibility.",
	"sha256": "68971ed8c9ddf662b50e3f07687a0ff37634e860f5fd43f45d21d48d51b24657",
	"addonVersionName": "2026.20.6",
	"addonVersionNumber": {
		"major": 2026,
		"minor": 20,
		"patch": 6
	},
	"minNVDAVersion": {
		"major": 2024,
		"minor": 1,
		"patch": 0
	},
	"lastTestedVersion": {
		"major": 2026,
		"minor": 1,
		"patch": 1
	},
	"channel": "stable",
	"publisher": "Çağrı Doğan <cagrid@hotmail.com>",
	"sourceURL": "https://github.com/Surveyor123/freeradio",
	"license": "GPL v2",
	"homepage": "https://github.com/Surveyor123/freeradio",
	"changelog": "\n### New Features\n\n- **Time-shift buffer**: Rewind and fast-forward live radio like a DVR, using a rolling ~10-minute buffer. Enable it from Settings or toggle it instantly with `Ctrl+Win+T`. Rewind 15 seconds with `Ctrl+Win+J`; fast-forward 15 seconds with `Ctrl+Win+K` — reaching the live edge automatically returns you to normal live playback.\n- Time-shift now supports **HLS (`.m3u8`) stations** in addition to plain HTTP/HTTPS and Shoutcast/Icecast (ICY) streams — segments are downloaded and reassembled into the same rewindable buffer.\n\n### Fixes\n\n- Fixed time-shift capture (and recording) failing with an SSL certificate error on stations whose server presents an expired or otherwise invalid TLS certificate.\n\n### Documentation\n\n- Added a full \"Time-Shift (Rewind Live Radio)\" section to the README, plus new shortcut and settings table entries.\n",
	"licenseURL": "https://www.gnu.org/licenses/gpl-2.0.html",
	"submissionTime": 1783777135000,
	"translations": []
}