{
	"addonId": "programRAMReporter",
	"displayName": "Program RAM Usage Reporter",
	"URL": "https://github.com/Ninjacoder42/programRAMReporter/releases/download/%23RAMUsageReporter/programRAMReporter.nvda-addon",
	"description": "This add-on allows you to check the RAM usage of your currently focused program.\nPress NVDA+Shift+9 to hear the current program's memory usage.",
	"sha256": "5961a2c8d16e697f6dbfbefd13ee65583ea5781a6bc30eb7527447a286d0263d",
	"addonVersionName": "1.0.0",
	"addonVersionNumber": {
		"major": 1,
		"minor": 0,
		"patch": 0
	},
	"minNVDAVersion": {
		"major": 2019,
		"minor": 3,
		"patch": 0
	},
	"lastTestedVersion": {
		"major": 2024,
		"minor": 1,
		"patch": 0
	},
	"channel": "dev",
	"publisher": "Justin",
	"sourceURL": "https://github.com/Ninjacoder42/programRAMReporter",
	"license": "GPL v2",
	"licenseURL": "https://www.gnu.org/licenses/gpl-2.0.html",
	"submissionTime": 1729889259000,
	"translations": []
}