{
	"addonId": "showSelectionWhenBrailleTetheredToReview",
	"displayName": "Show selection when braille is tethered to review",
	"URL": "https://github.com/burmancomp/show-selection-when-braille-tethered-to-review/releases/download/v2024.0914.0/showSelectionWhenBrailleTetheredToReview-2024.0914.0.nvda-addon",
	"description": "This is a beta version, and there may be issues.\nThere are likely very few testers which means that more or less use cases are\nnot tested. One such case is using braille input.\nIt Shows selection with dots 7 and 8 in edit controls and documents when\nbraille is tethered to review.",
	"sha256": "e040f018df16f211493c689ad24f075418362f39f884967fbecb08789a0d3c08",
	"addonVersionName": "2024.0914.0",
	"addonVersionNumber": {
		"major": 2024,
		"minor": 914,
		"patch": 0
	},
	"minNVDAVersion": {
		"major": 2024,
		"minor": 2,
		"patch": 0
	},
	"lastTestedVersion": {
		"major": 2025,
		"minor": 1,
		"patch": 0
	},
	"channel": "beta",
	"publisher": "Burman's Computer And Education Ltd.",
	"sourceURL": "https://github.com/burmancomp/show-selection-when-braille-tethered-to-review/",
	"license": "GPL v2",
	"homepage": "https://github.com/burmancomp/show-selection-when-braille-tethered-to-review",
	"licenseURL": "https://www.gnu.org/licenses/gpl-2.0.html",
	"translations": [],
	"reviewUrl": "https://github.com/nvaccess/addon-datastore/discussions/3762"
}
