{
	"addonId": "xPlorer",
	"displayName": "xPlorer",
	"URL": "https://github.com/chaichaimee/xPlorer/releases/download/2026.3-beta/xPlorer-v2026.3-beta.nvda-addon",
	"description": "Improve access to File Explorer.\nHot Keys:\nNVDA+Shift+X : Open xPlorer Context Menu\nNVDA+Shift+z Single Tap : Say Size\nNVDA+Shift+Z Double Tap : Compress Zip\nNVDA+Shift+C Single Tap : Copy Selected File and Folder Names\nNVDA+Shift+C Double Tap : Copy Address Bar Current Folder\nNVDA+Shift+V Single Tap : Copy Content\nNVDA+Shift+V Double Tap : Invert Selection\nNVDA+Shift+F2 : Rename File Only",
	"sha256": "277f61b36b9cb7ea8680afa7a9fe0c899e4aa93323831aa462467ec381d55114",
	"addonVersionName": "2026.3",
	"addonVersionNumber": {
		"major": 2026,
		"minor": 3,
		"patch": 0
	},
	"minNVDAVersion": {
		"major": 2022,
		"minor": 4,
		"patch": 0
	},
	"lastTestedVersion": {
		"major": 2026,
		"minor": 1,
		"patch": 0
	},
	"channel": "stable",
	"publisher": "chaichaimee",
	"sourceURL": "https://github.com/chaichaimee/xPlorer",
	"license": "GPL v2",
	"homepage": "https://github.com/chaichaimee/xPlorer",
	"licenseURL": "https://www.gnu.org/licenses/gpl-2.0.html",
	"submissionTime": 1771046796000,
	"translations": [
		{
			"language": "de",
			"displayName": "xPlorer",
			"description": "Verbesserter Zugriff auf den Datei-Explorer.\nTastenkombinationen:\nNVDA+Shift+X : xPlorer-Kontextmenü öffnen\nNVDA+Shift+Z Einmal drücken : Größe ansagen\nNVDA+Shift+Z Zweimal drücken : Als ZIP komprimieren\nNVDA+Shift+C Einmal drücken : Namen der ausgewählten Dateien und Ordner kopieren\nNVDA+Shift+C Zweimal drücken : Pfad der Adressleiste des aktuellen Ordners kopieren\nNVDA+Shift+V Einmal drücken : Inhalt kopieren\nNVDA+Shift+V Zweimal drücken : Auswahl umkehren\nNVDA+Shift+F2 : Nur Datei umbenennen"
		},
		{
			"language": "en",
			"displayName": "xPlorer",
			"description": "Improve access to File Explorer.\nHot Keys:\nNVDA+Shift+X : Open xPlorer Context Menu\nNVDA+Shift+z Single Tap : Say Size\nNVDA+Shift+Z Double Tap : Compress Zip\nNVDA+Shift+C Single Tap : Copy Selected File and Folder Names\nNVDA+Shift+C Double Tap : Copy Address Bar Current Folder\nNVDA+Shift+V Single Tap : Copy Content\nNVDA+Shift+V Double Tap : Invert Selection\nNVDA+Shift+F2 : Rename File Only"
		},
		{
			"language": "es",
			"displayName": "xPlorer",
			"description": "Mejora el acceso al Explorador de archivos.\nTeclas rápidas:\nNVDA+Shift+X : Abrir el menú contextual de xPlorer\nNVDA+Shift+Z Un toque : Decir tamaño\nNVDA+Shift+Z Dos toques : Comprimir en Zip\nNVDA+Shift+C Un toque : Copiar nombres de archivos y carpetas seleccionados\nNVDA+Shift+C Dos toques : Copiar la barra de direcciones de la carpeta actual\nNVDA+Shift+V Un toque : Copiar contenido\nNVDA+Shift+V Dos toques : Invertir selección\nNVDA+Shift+F2 : Renombrar solo archivo"
		},
		{
			"language": "fr",
			"displayName": "xPlorer",
			"description": "Améliore l'accès à l'Explorateur de fichiers.\nTouches de raccourci :\nNVDA+Shift+X : Ouvrir le menu contextuel xPlorer\nNVDA+Shift+Z Une pression : Annoncer la taille\nNVDA+Shift+Z Deux pressions : Compresser en Zip\nNVDA+Shift+C Une pression : Copier les noms des fichiers et dossiers sélectionnés\nNVDA+Shift+C Deux pressions : Copier la barre d'adresse du dossier actuel\nNVDA+Shift+V Une pression : Copier le contenu\nNVDA+Shift+V Deux pressions : Inverser la sélection\nNVDA+Shift+F2 : Renommer le fichier uniquement"
		},
		{
			"language": "ru",
			"displayName": "xPlorer",
			"description": "Улучшение доступа к Проводнику Windows.\nГорячие клавиши:\nNVDA+Shift+X : Открыть контекстное меню xPlorer\nNVDA+Shift+Z Одно нажатие : Озвучить размер\nNVDA+Shift+Z Два нажатия : Сжать в Zip\nNVDA+Shift+C Одно нажатие : Копировать имена выбранных файлов и папок\nNVDA+Shift+C Два нажатия : Копировать путь из адресной строки текущей папки\nNVDA+Shift+V Одно нажатие : Копировать содержимое\nNVDA+Shift+V Два нажатия : Инвертировать выделение\nNVDA+Shift+F2 : Переименовать только файл"
		}
	]
}