{
	"addonId": "dateParser",
	"displayName": "Parses and speaks date and time expressions",
	"URL": "https://github.com/OnjLouis/dateParser/releases/download/v1.1.0/dateParser-1.1.0.nvda-addon",
	"description": "Adds a global NVDA script (NVDA+Alt+E) to parse natural date and duration expressions and speak the result.",
	"sha256": "b1bbc8a61c1e17e8b6f5461efb188ec1b6c74cd3b3159955f149ddffa07e095e",
	"addonVersionName": "1.1.0",
	"addonVersionNumber": {
		"major": 1,
		"minor": 1,
		"patch": 0
	},
	"minNVDAVersion": {
		"major": 2025,
		"minor": 1,
		"patch": 1
	},
	"lastTestedVersion": {
		"major": 2026,
		"minor": 1,
		"patch": 0
	},
	"channel": "stable",
	"publisher": "Andre Louis",
	"sourceURL": "https://github.com/OnjLouis/dateParser",
	"license": "GPL v2",
	"homepage": "https://github.com/OnjLouis/dateParser",
	"licenseURL": "https://www.gnu.org/licenses/gpl-2.0.html",
	"submissionTime": 1789913172000,
	"translations": []
}