{
	"addonId": "leanCalendar",
	"displayName": "leanCalendar",
	"URL": "https://github.com/cary-rowen/leanCalendar/releases/download/v0.2.3/leanCalendar-0.2.3.nvda-addon",
	"description": "Reports Chinese lunar date, solar terms, Gregorian date and time details, and an interactive calendar query dialog.",
	"sha256": "2e370a5e8e0cf5736c0cdfa271a7d1bad02bdf56e03a5333563af3d2cab66f44",
	"addonVersionName": "0.2.3",
	"addonVersionNumber": {
		"major": 0,
		"minor": 2,
		"patch": 3
	},
	"minNVDAVersion": {
		"major": 2025,
		"minor": 1,
		"patch": 0
	},
	"lastTestedVersion": {
		"major": 2026,
		"minor": 1,
		"patch": 0
	},
	"channel": "stable",
	"publisher": "Cary-rowen <manchen_0528@outlook.com>",
	"sourceURL": "https://github.com/cary-rowen/leanCalendar",
	"license": "GPL v2",
	"homepage": "https://github.com/cary-rowen/leanCalendar",
	"changelog": "### 0.2.3\n\n* Dependent Updates.",
	"licenseURL": "https://www.gnu.org/licenses/gpl-2.0.html",
	"submissionTime": 1782011377000,
	"translations": [
		{
			"language": "zh",
			"displayName": "简易万年历",
			"description": "读出农历日期、节气、公历日期和时间详情，并提供可交互的万年历查询对话框。",
			"changelog": "### 0.2.3\n\n* Dependent Updates."
		}
	]
}