{
	"addonId": "timezone",
	"displayName": "Time Zoner",
	"URL": "https://github.com/munawarb/NVDA-Time-Zoner/releases/download/v3.02/timezone-3.02.nvda-addon",
	"description": "Announces the time and date in selected timezones. Use the Settings dialog to set timezones you want to hear. After you do this, press NVDA+ALT+UP/DOWN ARROW to cycle through your timezone ring and hear times in your selected timezones.",
	"sha256": "83df8d9e50e299cc9a11edd8b7531f82b5b7f222c45cfb7f0087c55c7e9023a6",
	"addonVersionName": "3.02",
	"addonVersionNumber": {
		"major": 3,
		"minor": 2,
		"patch": 0
	},
	"minNVDAVersion": {
		"major": 2021,
		"minor": 1,
		"patch": 0
	},
	"lastTestedVersion": {
		"major": 2023,
		"minor": 1,
		"patch": 0
	},
	"channel": "stable",
	"publisher": "Munawar Bijani",
	"sourceURL": "https://github.com/munawarb/NVDA-Time-Zoner",
	"license": "GPL v2",
	"homepage": "https://github.com/munawarb/NVDA-Time-Zoner",
	"licenseURL": "https://www.gnu.org/licenses/gpl-2.0.html",
	"translations": [
		{
			"language": "en",
			"displayName": "Time Zoner",
			"description": "Announces the time and date in selected timezones. Use the Settings dialog to set timezones you want to hear. After you do this, press NVDA+ALT+UP/DOWN ARROW to cycle through your timezone ring and hear times in your selected timezones."
		},
		{
			"language": "pt_BR",
			"displayName": "An\u00fancio de horas em diferentes fusos hor\u00e1rios",
			"description": "Announces the time and date in selected timezones. Use the Settings dialog to set timezones you want to hear. After you do this, press NVDA+ALT+UP/DOWN ARROW to cycle through your timezone ring and hear times in your selected timezones."
		},
		{
			"language": "pt_PT",
			"displayName": "An\u00fancio de horas em diferentes fusos hor\u00e1rios",
			"description": "Announces the time and date in selected timezones. Use the Settings dialog to set timezones you want to hear. After you do this, press NVDA+ALT+UP/DOWN ARROW to cycle through your timezone ring and hear times in your selected timezones."
		}
	]
}