{
	"addonId": "Access8Math",
	"displayName": "Access8Math",
	"URL": "https://github.com/tsengwoody/Access8Math/releases/download/v4.5/Access8Math-4.5.nvda-addon",
	"description": "Allows access math content written by MathML ; Allows write math content by LaTeX",
	"sha256": "6704f0a11d0057766901b7e94ccb20a16bd2c21169384fdfe5193853dfdd0a7d",
	"addonVersionName": "4.5",
	"addonVersionNumber": {
		"major": 4,
		"minor": 5,
		"patch": 0
	},
	"minNVDAVersion": {
		"major": 2024,
		"minor": 1,
		"patch": 0
	},
	"lastTestedVersion": {
		"major": 2025,
		"minor": 3,
		"patch": 3
	},
	"channel": "stable",
	"publisher": "Tseng Woody",
	"sourceURL": "https://github.com/tsengwoody/Access8Math",
	"license": "GPL v2",
	"homepage": "https://github.com/tsengwoody/Access8Math",
	"changelog": "Added an HTML color scheme setting for preview and export output.\nRefactored the math provider and writer layers to improve package structure and maintainability.\nSimplified bundled dependencies by removing unused web/template shims and cleaning up import paths.",
	"licenseURL": "https://www.gnu.org/licenses/gpl-2.0.html",
	"submissionTime": 1774624588000,
	"translations": [
		{
			"language": "de",
			"displayName": "Access8Math",
			"description": "Ermöglicht es, mathematische Inhalte im MathML-Format zu lesen sowie Math-ML mittels Latex zu erzeugen",
			"changelog": "Added an HTML color scheme setting for preview and export output.\nRefactored the math provider and writer layers to improve package structure and maintainability.\nSimplified bundled dependencies by removing unused web/template shims and cleaning up import paths."
		},
		{
			"language": "es",
			"displayName": "Access8Math",
			"description": "Permite acceder a contenido matemático escrito en MathML; permite escribir contenido matemático en LaTeX",
			"changelog": "Added an HTML color scheme setting for preview and export output.\nRefactored the math provider and writer layers to improve package structure and maintainability.\nSimplified bundled dependencies by removing unused web/template shims and cleaning up import paths."
		},
		{
			"language": "fr",
			"displayName": "Access8Math",
			"description": "Permet l'accès au contenu mathématique écrit en MathML ; Permet d'écrire du contenu mathématique en LaTeX",
			"changelog": "Added an HTML color scheme setting for preview and export output.\nRefactored the math provider and writer layers to improve package structure and maintainability.\nSimplified bundled dependencies by removing unused web/template shims and cleaning up import paths."
		},
		{
			"language": "gl",
			"displayName": "Access8Math",
			"description": "Permite acesar a contido matemático escrebido en MathML; permite escrebir contido matemático en LaTeX",
			"changelog": "Added an HTML color scheme setting for preview and export output.\nRefactored the math provider and writer layers to improve package structure and maintainability.\nSimplified bundled dependencies by removing unused web/template shims and cleaning up import paths."
		},
		{
			"language": "it",
			"displayName": "Access8Math",
			"description": "Consente di accedere a contenuti matematici scritti con MathML; Consente di scrivere contenuti matematici con LaTeX",
			"changelog": "Added an HTML color scheme setting for preview and export output.\nRefactored the math provider and writer layers to improve package structure and maintainability.\nSimplified bundled dependencies by removing unused web/template shims and cleaning up import paths."
		},
		{
			"language": "pt_BR",
			"displayName": "Access8Math",
			"description": "Permite acessar conteúdo matemático escrito com MathML; Permite escrever conteúdo matemático através de LaTeX",
			"changelog": "Added an HTML color scheme setting for preview and export output.\nRefactored the math provider and writer layers to improve package structure and maintainability.\nSimplified bundled dependencies by removing unused web/template shims and cleaning up import paths."
		},
		{
			"language": "pt_PT",
			"displayName": "Access8Math",
			"description": "Permite aceder a conteúdos matemáticos escritos em MathML; Permite escrever conteúdos matemáticos em LaTeX",
			"changelog": "Added an HTML color scheme setting for preview and export output.\nRefactored the math provider and writer layers to improve package structure and maintainability.\nSimplified bundled dependencies by removing unused web/template shims and cleaning up import paths."
		},
		{
			"language": "ro",
			"displayName": "Access8Math",
			"description": "Permite accesul la conținut matematic scris de MathML; Permite scrierea conținutului matematic prin LaTeX",
			"changelog": "Added an HTML color scheme setting for preview and export output.\nRefactored the math provider and writer layers to improve package structure and maintainability.\nSimplified bundled dependencies by removing unused web/template shims and cleaning up import paths."
		},
		{
			"language": "ru",
			"displayName": "Access8Math",
			"description": "Предоставляет доступ к математическим выражениям, написанным на MathML; позволяет записывать математические выражения с помощью LaTeX",
			"changelog": "Added an HTML color scheme setting for preview and export output.\nRefactored the math provider and writer layers to improve package structure and maintainability.\nSimplified bundled dependencies by removing unused web/template shims and cleaning up import paths."
		},
		{
			"language": "tr",
			"displayName": "Access8Math",
			"description": "MathML ile yazılan matematik içeriğine erişime sağlar ve LaTeX ile matematik içeriği oluşturmaya izin verir",
			"changelog": "Added an HTML color scheme setting for preview and export output.\nRefactored the math provider and writer layers to improve package structure and maintainability.\nSimplified bundled dependencies by removing unused web/template shims and cleaning up import paths."
		},
		{
			"language": "zh_CN",
			"displayName": "Access8Math",
			"description": "可以閱讀 MathML 編寫的數學內容；可以使用 LaTeX 書寫數學內容",
			"changelog": "Added an HTML color scheme setting for preview and export output.\nRefactored the math provider and writer layers to improve package structure and maintainability.\nSimplified bundled dependencies by removing unused web/template shims and cleaning up import paths."
		},
		{
			"language": "zh_TW",
			"displayName": "Access8Math",
			"description": "允許閱讀 MathML 編寫的數學內容；允許通過 LaTeX 書寫數學內容",
			"changelog": "Added an HTML color scheme setting for preview and export output.\nRefactored the math provider and writer layers to improve package structure and maintainability.\nSimplified bundled dependencies by removing unused web/template shims and cleaning up import paths."
		}
	]
}
